{
  "$schema": "../_schema/manifest.schema.json",
  "id": "with-hyperlink",
  "title": "A document with a hyperlink",
  "tier": "intermediate",
  "chapter": "cross-references-hyperlinks",
  "concept": "A Hyperlink joins a text source in the story to a URL destination in the design map; the destination is named by a typed Properties child, and the block follows the last story.",
  "packageDir": "package",
  "editable": {
    "part": "designmap.xml",
    "language": "xml",
    "label": "designmap.xml"
  },
  "views": [
    "raw",
    "annotated",
    "tree"
  ],
  "annotations": [
    {
      "lines": "13",
      "note": "HyperlinkURLDestination: the target. DestinationURL holds the web address. The whole navigation block comes after the last idPkg:Story include, or InDesign does not bind it."
    },
    {
      "lines": "14",
      "note": "Hyperlink: Source names the HyperlinkTextSource that wraps the linked words inside the story."
    },
    {
      "lines": "17",
      "note": "The destination is a typed Properties child that names the object as Type/Self. A Destination attribute is ignored by InDesign, and combined with DestinationUniqueKey it makes the file unopenable."
    }
  ],
  "expect": {
    "opens": true,
    "builds": true,
    "pages": 1,
    "stories": 1,
    "frames": 1,
    "paragraphs": 1,
    "runs": 3
  },
  "pathological": false,
  "license": "MIT"
}
