{
  "$schema": "../_schema/manifest.schema.json",
  "id": "dangling-story",
  "title": "A dangling story reference",
  "tier": "pro",
  "chapter": "edge-cases",
  "concept": "The design map still lists a story whose part has been removed from the archive. A reader that resolves every part the design map names finds nothing for this one; Paged stops with a MissingEntry error that names the path instead of guessing.",
  "packageDir": "package",
  "editable": {
    "part": "designmap.xml",
    "language": "xml",
    "label": "designmap.xml"
  },
  "views": [
    "raw",
    "annotated",
    "tree"
  ],
  "annotations": [
    {
      "lines": "3",
      "note": "StoryList still names ustory as a story belonging to this document."
    },
    {
      "lines": "11",
      "note": "This idPkg:Story line points the loader at Stories/Story_ustory.xml \u2014 but that part no longer exists in the package. This is the dangling reference."
    }
  ],
  "expect": {
    "opens": false,
    "builds": false
  },
  "pathological": true,
  "license": "MIT",
  "verified": {
    "status": "not-applicable",
    "reason": "A pathological package on purpose: InDesign drops the unplaced story on open."
  }
}
